{
  "$schema": "http://json-schema.org/draft-07/schema#",
  "$id": "harmonicon/lesson",
  "title": "Harmonicon Lesson Manifest",
  "description": "One lesson in the curriculum: localized title/body keys, an optional playable chart, prerequisites, and pass criteria.",
  "type": "object",
  "required": [
    "id",
    "unit",
    "title_key",
    "body_key"
  ],
  "additionalProperties": false,
  "properties": {
    "id": {
      "type": "string",
      "minLength": 1,
      "description": "Stable identifier, unique across all lessons. Used as the profile key and in other lessons' prerequisites \u2014 never rename one that has shipped."
    },
    "unit": {
      "type": "string",
      "minLength": 1,
      "description": "Unit identifier grouping lessons in the menu. Localized via the Fluent key `lesson-unit-<unit>`."
    },
    "optional": {
      "type": "boolean",
      "description": "Marks an elective lesson. Electives keep their own prerequisites but never count toward unit gates or block the required course. Absent/false = core curriculum."
    },
    "track": {
      "type": "string",
      "minLength": 1,
      "description": "Which row of the skill tree this lesson sits in (see docs/training_tree_plan.md). Optional: falls back to `unit`, so an externally authored lesson without one still groups sensibly. Localized via the Fluent key `lesson-track-<track>`."
    },
    "title_key": {
      "type": "string",
      "minLength": 1,
      "description": "Fluent key for the lesson's title."
    },
    "body_key": {
      "type": "string",
      "minLength": 1,
      "description": "Fluent key for the lesson's instructional body text."
    },
    "chart": {
      "type": "string",
      "minLength": 1,
      "description": "Path to a .harpchart, relative to the lesson's own directory. Absent = instructional-only lesson (no playable drill)."
    },
    "aural": {
      "type": "boolean",
      "description": "Hide the scrolling note prompts during a chart-backed ear-training lesson. The synthesized call still plays and scoring still waits for the response. Absent/false keeps ordinary visual prompts."
    },
    "prerequisites": {
      "type": "array",
      "items": {
        "type": "string",
        "minLength": 1
      },
      "uniqueItems": true,
      "description": "Lesson ids that must be passed before this one unlocks."
    },
    "pass_criteria": {
      "type": "object",
      "required": [
        "type"
      ],
      "oneOf": [
        {
          "required": [
            "type",
            "threshold"
          ],
          "additionalProperties": false,
          "properties": {
            "type": {
              "const": "accuracy"
            },
            "threshold": {
              "type": "number",
              "exclusiveMinimum": 0,
              "maximum": 1,
              "description": "Minimum overall weighted accuracy (0..1) to pass."
            }
          }
        },
        {
          "required": [
            "type",
            "technique",
            "threshold"
          ],
          "additionalProperties": false,
          "properties": {
            "type": {
              "const": "technique"
            },
            "technique": {
              "type": "string",
              "enum": [
                "normal",
                "bend",
                "vibrato",
                "wah-wah",
                "overblow",
                "overdraw",
                "slide",
                "clean-attack"
              ],
              "description": "Technique bucket name \u2014 the same vocabulary SongStats/profile use."
            },
            "threshold": {
              "type": "number",
              "exclusiveMinimum": 0,
              "maximum": 1,
              "description": "Minimum accuracy (0..1) on that technique's notes to pass."
            }
          }
        },
        {
          "required": [
            "type",
            "threshold"
          ],
          "additionalProperties": false,
          "properties": {
            "type": {
              "const": "scale-adherence"
            },
            "threshold": {
              "type": "number",
              "exclusiveMinimum": 0,
              "maximum": 1,
              "description": "Minimum fraction (0..1) of notes played during the jam that were at least in-scale. Routes the lesson into Jam Session instead of the normal chart pipeline \u2014 see PassCriteria::ScaleAdherence."
            }
          }
        },
        {
          "required": [
            "type",
            "threshold"
          ],
          "additionalProperties": false,
          "properties": {
            "type": {
              "const": "chord-tone-adherence"
            },
            "threshold": {
              "type": "number",
              "exclusiveMinimum": 0,
              "maximum": 1,
              "description": "Minimum fraction (0..1) of notes played during the jam that were specifically chord tones (stricter than scale-adherence). Routes into Jam Session like scale-adherence \u2014 see PassCriteria::ChordToneAdherence."
            }
          }
        },
        {
          "required": [
            "type",
            "threshold"
          ],
          "additionalProperties": false,
          "properties": {
            "type": {
              "const": "phrase-discipline"
            },
            "threshold": {
              "type": "number",
              "exclusiveMinimum": 0,
              "maximum": 1,
              "description": "Minimum fraction (0..1) of notes played outside a rest window of the jam's play/rest bar pattern. Routes into Jam Session like scale-adherence \u2014 see PassCriteria::PhraseDiscipline."
            }
          }
        }
      ],
      "description": "How a chart-backed lesson is judged at the results screen (or, for a scale-adherence/chord-tone-adherence/phrase-discipline lesson, by its own \"Finish Lesson\" jam pause-menu button \u2014 see PassCriteria::ScaleAdherence). Absent = playing it through at all counts as done (or, for instructional-only lessons, the reader's Mark-as-Done button)."
    },
    "training": {
      "type": "object",
      "description": "Generated practice drills for this lesson (docs/training_tree_plan.md). Absent means the lesson has no trainings, which is correct for anything instructional-only: where the microphone cannot verify the technique, five exercises would only pretend to check it.",
      "properties": {
        "technique": {
          "type": "string",
          "enum": [
            "bend"
          ],
          "description": "What the drills train. Only techniques that change which pitch a hole produces; an expression technique shapes a note rather than choosing it and needs a different generator."
        },
        "holes": {
          "type": "array",
          "items": {
            "type": "integer",
            "minimum": 1,
            "maximum": 16
          },
          "minItems": 1,
          "description": "Holes the lesson covers, in teaching order. The first is what the isolating tiers drill on its own."
        },
        "seed": {
          "type": "integer",
          "minimum": 0,
          "description": "Fixes the generated order so a retry is the same exercise. Derived from the lesson id when absent."
        }
      },
      "required": [
        "technique",
        "holes"
      ],
      "additionalProperties": false
    },
    "progression": {
      "type": "string",
      "enum": [
        "standard",
        "quick-change",
        "minor",
        "jazz-blues"
      ],
      "description": "A jam-based lesson's backing progression, seeded into the jam when Start routes into it. Absent = Standard. See menu::lessons::parse_progression."
    },
    "scale": {
      "type": "string",
      "enum": [
        "first-position",
        "second-position",
        "third-position",
        "major",
        "minor-pentatonic",
        "country"
      ],
      "description": "A jam-based lesson's scale for live scale-adherence feedback, seeded into JamScale when Start routes into it. Absent = first-position (the blues hexatonic). See menu::lessons::parse_scale."
    },
    "diagram": {
      "type": "string",
      "enum": [
        "circle-of-fifths"
      ],
      "description": "An instructional lesson's embedded reference diagram, rendered by the lesson reader alongside the body text. Absent = no diagram. See dialogs::circle_of_fifths."
    },
    "widgets": {
      "type": "array",
      "description": "Reusable teaching aids rendered below the lesson body. Absent means the lesson has no embedded tools.",
      "items": {
        "type": "object",
        "required": ["type"],
        "oneOf": [
          {
            "additionalProperties": false,
            "properties": {
              "type": { "const": "circle-of-fifths" },
              "harp_key": { "type": "string", "minLength": 1 },
              "positions": {
                "type": "array",
                "items": { "type": "string", "enum": ["first", "second", "third", "fourth", "fifth", "twelfth"] },
                "uniqueItems": true
              }
            }
          },
          {
            "additionalProperties": false,
            "properties": {
              "type": { "const": "twelve-bar-grid" },
              "key": { "type": "string", "minLength": 1 },
              "progression": { "type": "string", "enum": ["standard", "quick-change", "minor", "jazz-blues"] },
              "sync_group": { "type": "string", "minLength": 1 }
            }
          },
          {
            "additionalProperties": false,
            "properties": {
              "type": { "const": "form-map" },
              "sections": {
                "type": "array",
                "items": { "type": "string", "minLength": 1, "maxLength": 12 },
                "minItems": 2,
                "maxItems": 16
              }
            },
            "required": ["sections"]
          },
          {
            "additionalProperties": false,
            "properties": {
              "type": { "const": "rhythm-pattern" },
              "steps": {
                "type": "array",
                "items": {
                  "type": "object",
                  "additionalProperties": false,
                  "required": ["label"],
                  "properties": {
                    "label": { "type": "string", "minLength": 1, "maxLength": 12 },
                    "rest": { "type": "boolean" },
                    "accent": { "type": "boolean" }
                  }
                },
                "minItems": 2,
                "maxItems": 32
              }
            },
            "required": ["steps"]
          },
          {
            "additionalProperties": false,
            "properties": {
              "type": { "const": "phrase-looper" },
              "steps": {
                "type": "array",
                "items": { "type": "string", "minLength": 1, "maxLength": 24 },
                "minItems": 2,
                "maxItems": 16
              },
              "bpm": { "type": "number", "minimum": 30, "maximum": 300 },
              "beats_per_step": { "type": "number", "minimum": 0.25, "maximum": 16 }
            },
            "required": ["steps"]
          },
          {
            "additionalProperties": false,
            "properties": {
              "type": { "const": "metronome" },
              "bpm": { "type": "number", "minimum": 30, "maximum": 300 },
              "tempo_steps": {
                "type": "array",
                "items": { "type": "number", "minimum": 30, "maximum": 300 },
                "minItems": 1
              },
              "bars_per_step": { "type": "integer", "minimum": 1, "maximum": 32 },
              "beats_per_bar": { "type": "integer", "minimum": 1, "maximum": 12 },
              "feel": { "type": "string", "enum": ["straight", "shuffle", "triplet"] },
              "sync_group": { "type": "string", "minLength": 1 }
            }
          }
        ]
      }
    },
    "position_cycle": {
      "type": "boolean",
      "description": "A jam-based lesson that periodically calls a new position (cycling JamScale through First/Second/Third position every few bars), seeded into JamPositionCycle when Start routes into it. Absent/false = the jam's scale field stays fixed for the whole session. See jam::position_guide."
    }
  }
}
