{
  "id": "licks-over-changes",
  "unit": "blues",
  "track": "vocabulary",
  "title_key": "lesson-licks-over-changes-title",
  "body_key": "lesson-licks-over-changes-body",
  "widgets": [
    {"type":"phrase-looper","steps":["Turn: +6","-5","-4","-3'","-2"],"bpm":80,"beats_per_step":0.8},
    { "type": "twelve-bar-grid", "key": "G", "sync_group": "form" },
    { "type": "metronome", "bpm": 80, "beats_per_bar": 4, "feel": "straight", "sync_group": "form" }
  ],
  "chart": "song/chart.harpchart",
  "prerequisites": [
    "bent-licks",
    "bar-counting"
  ],
  "pass_criteria": {
    "type": "accuracy",
    "threshold": 0.6
  }
}
