{"id":"arpeggio-to-scale","unit":"musicianship","optional":true,"track":"harmony","title_key":"lesson-arpeggio-scale-title","body_key":"lesson-arpeggio-scale-body","widgets":[{"type":"phrase-looper","steps":["Chord: +4","+5","+6","+7"],"bpm":68,"beats_per_step":1.13},{"type":"phrase-looper","steps":["Scale: -7","-6","+6","-5","+5","-4","+4"],"bpm":68,"beats_per_step":1.13}],"chart":"song/chart.harpchart","prerequisites":["guide-tones","major-scale"],"pass_criteria":{"type":"accuracy","threshold":0.7}}
