{"id":"loop-isolation","unit":"practice","optional":true,"track":"practice","title_key":"lesson-loop-isolation-title","body_key":"lesson-loop-isolation-body","widgets":[{"type":"phrase-looper","steps":["Context in","Problem","Context out"],"bpm":60,"beats_per_step":1}],"prerequisites":["slow-practice"]}
