{"id":"chromatic-fragments","unit":"chromatic","optional":true,"track":"slide","title_key":"lesson-chromatic-fragments-title","body_key":"lesson-chromatic-fragments-body","widgets":[{"type":"phrase-looper","steps":["Cell 1: +1","+1*","-1","-1*"],"bpm":68,"beats_per_step":0.8},{"type":"phrase-looper","steps":["Cell 2: +2","-2","-2*","+3"],"bpm":68,"beats_per_step":0.8},{"type":"phrase-looper","steps":["Descend: +3","-2*","-2","+2"],"bpm":68,"beats_per_step":0.8}],"chart":"song/chart.harpchart","prerequisites":["enharmonic-slide-choices"],"pass_criteria":{"type":"accuracy","threshold":0.7}}
