{"id":"vocal-fills","unit":"accompaniment","optional":true,"track":"accompaniment","title_key":"lesson-vocal-fills-title","body_key":"lesson-vocal-fills-body","widgets":[{"type":"phrase-looper","steps":["Answer 1: -2","-3","-2"],"bpm":70,"beats_per_step":0.93},{"type":"phrase-looper","steps":["Answer 2: +4","-4","-2"],"bpm":70,"beats_per_step":0.93}],"chart":"song/chart.harpchart","prerequisites":["behind-a-singer","first-licks"],"pass_criteria":{"type":"accuracy","threshold":0.65}}
