{"id":"guide-tones","unit":"musicianship","optional":true,"track":"harmony","title_key":"lesson-guide-tones-title","body_key":"lesson-guide-tones-body","widgets":[{"type":"phrase-looper","steps":["ii 3rd: -5","ii 7th: +7","V 3rd: -7","V 7th: -5","I 3rd: +5","I 7th: -7"],"bpm":60,"beats_per_step":2}],"chart":"song/chart.harpchart","prerequisites":["chord-construction","ii-v-i-chord-tones"],"pass_criteria":{"type":"accuracy","threshold":0.65}}
