{"id":"legato-slide-phrasing","unit":"chromatic","optional":true,"track":"slide","title_key":"lesson-legato-slide-phrasing-title","body_key":"lesson-legato-slide-phrasing-body","widgets":[{"type":"phrase-looper","steps":["Breath: +1","+1*","-1","-1*","+2"],"bpm":60,"beats_per_step":1.25},{"type":"phrase-looper","steps":["Release: -2","-2*","+3"],"bpm":60,"beats_per_step":1.25}],"chart":"song/chart.harpchart","prerequisites":["chromatic-fragments"],"pass_criteria":{"type":"technique","technique":"slide","threshold":0.65}}
